Title,URL,Date
What Is Data Scraping And How Can You Use It? - Target ...,https://www.targetinternet.com/what-is-data-scraping-and-how-can-you-use-it/,13 сент. 2017 г.
What is data scraping? - YouTube,https://www.youtube.com/watch?v=COeMzrSYgvw,30 окт. 2020 г.
7 Best Web Scraping Tools To Extract Data - Better ...,https://betterprogramming.pub/data-scraping-tools-7cb76eeab89e,26 апр. 2021 г.
What is DATA SCRAPING? What does DATA ... - YouTube,https://www.youtube.com/watch?v=omTtMylcWOI,21 сент. 2017 г.
Python Web Scraping Tutorial: Step-By-Step [2022 Guide],https://oxylabs.io/blog/python-web-scraping,6 янв. 2022 г.
What is Web Scraping and What is it Used For? | ParseHub,https://www.parsehub.com/blog/what-is-web-scraping/,1 авг. 2021 г.
8 Best Web Scraping Tools - Learn - Hevo Data,https://hevodata.com/learn/8-best-web-scraping-tools/,6 февр. 2021 г.
Watch | What is data scraping? - The Hindu,https://www.thehindu.com/sci-tech/technology/what-is-data-scraping/article32908610.ece,21 окт. 2020 г.
10 FREE Web Scrapers That You Cannot Miss in 2022,https://www.octoparse.com/blog/9-free-web-scrapers-that-you-cannot-miss,19 мар. 2022 г.
Top Data Scraping Tools you must know for 2022 to assist ...,https://www.octoparse.com/blog/best-data-scraping-tools-for-2021,18 мар. 2022 г.
Extract data from any website without code | Bardeen Scraper,https://www.bardeen.ai/scraper,17 июн. 2021 г.
How to scrape data from a website with OpenRPA - Full Tutorial,https://www.youtube.com/watch?v=sUQL2-rFOfw,12 июн. 2020 г.
RPA Use Case: Facebook Data Scraping - Sunflower Lab,https://www.thesunflowerlab.com/blog/rpa-use-case-facebook-data-scraping/,20 дек. 2021 г.
Data Scraping Crawler | Phantombuster,https://phantombuster.com/automations/toolbox/22972/data-scraping-crawler,25 авг. 2021 г.
"Web scraping, data scraping, data mining and data extraction ...",https://www.upwork.com/services/product/web-scraping-data-scraping-data-mining-and-data-extraction-with-python-1468211889388482560,12 дек. 2021 г.
data scraping | FUNDACIÓ BIT,https://www.fundaciobit.org/es/tag/data-scraping-es/,21 мар. 2019 г.
Data Scraping | Gavagai,https://www.gavagai.io/solutions/scraping/,24 янв. 2020 г.
Context on the recent US decision to legalize LinkedIn data ...,https://www.datacollaboration.org/post/context-regarding-the-recent-us-decision-on-linkedin-data-scraping,1 месяц назад
Data scraping – the attraction and the legal and ethical risks,https://www.privacylaws.com/events-gateway/events/datascraping2021/,12 окт. 2021 г.
Web Data Extraction Automation - UiPath,https://www.uipath.com/learning/video-tutorials/web-data-extraction-automation,19 янв. 2021 г.
Helium Scraper,https://www.heliumscraper.com/eng/,29 дек. 2010 г.
Web scraping data with Azure Data Factory - SQLShack,https://www.sqlshack.com/web-scraping-data-with-azure-data-factory/,3 авг. 2021 г.
Web Scraping Examples: How are Businesses Using Web ...,https://www.parsehub.com/blog/web-scraping-examples/,1 февр. 2022 г.
Scrape Web Data with Google Chrome - YouTube,https://www.youtube.com/watch?v=Z2iO5kaavwM,29 июн. 2018 г.
Tidy web scraping in R — Tutorial and resources - Towards ...,https://towardsdatascience.com/tidy-web-scraping-in-r-tutorial-and-resources-ac9f72b4fe47,16 авг. 2019 г.
5 Things You Need to Know Before Scraping Data From ...,https://www.octoparse.com/blog/5-things-you-need-to-know-before-scraping-data-from-facebook,12 авг. 2021 г.
Web Scraping 101: 10 Myths that Everyone Should Know,https://www.octoparse.com/blog/10-myths-about-web-scraping,16 авг. 2021 г.
Web Scraping Software - UiPath,https://www.uipath.com/solutions/technology/web-scraping-software,31 янв. 2015 г.
Data Scraping for SEO & Analytics - Tutorial - Optimize Smart,https://www.optimizesmart.com/data-scraping-guide-for-seo/,26 авг. 2021 г.
Scraping Data for Digital Marketers .. No Coding Experience ...,https://medium.com/@saijogeorge/scraping-data-for-digital-marketers-96f0c397a7ea,8 авг. 2014 г.
Web Scraping : Théorie et Application accessible à tous,https://datascientest.com/web-scraping-theorie-et-application-accessible-a-tous,3 сент. 2020 г.
Web scraping for Beginners | Introduction guide - ParseHub,https://www.parsehub.com/blog/beginners-guide-to-web-scraping/,17 нояб. 2020 г.
Scraping Data from the Web | Online RPA with UiPath Training,https://kubicle.com/learn/rpa-with-uipath/scraping-data-from-the-web,7 июн. 2021 г.
NoCoding Data Scraper - Easy Web Scraping - Microsoft ...,https://microsoftedge.microsoft.com/addons/detail/nocoding-data-scraper-i/daiklcgdelcbcmjepemiklfglodmofbm,27 авг. 2020 г.
UiPath Tutorial 27 | Data Scraping - Resolving Issues | Part 2,https://www.youtube.com/watch?v=CgqpSLerjLs,4 сент. 2020 г.
Website Data Scraping Into Excel - RPA Videos - HelpSystems,https://www.helpsystems.com/solutions/automation/robotic-process-automation/video-use-case?wchannelid=yt1ex9odqo&wmediaid=pen20lx82a,1 месяц назад
Implementing Web Scraping in Python with BeautifulSoup,https://www.geeksforgeeks.org/implementing-web-scraping-python-beautiful-soup/,2 недели назад
Top Web Scraping Services For Your Ecommerce Store,https://firebearstudio.com/blog/ecommerce-magento-web-scraping.html,13 февр. 2017 г.
Best Data Scraping Tools for 2021 (Top 10 Reviews),https://medium.datadriveninvestor.com/best-data-scraping-tools-for-2019-top-10-reviews-4a686061a184,6 мая 2019 г.
Is Web Scraping Legal? Explanation and Examples | ParseHub,https://www.parsehub.com/blog/web-scraping-legal/,14 июл. 2021 г.
4.3 Data Scraping & Cleaning Tools - Mavs Open Press,https://uta.pressbooks.pub/datanotebook/chapter/4-3-data-scraping-software/,10 окт. 2021 г.
Data Scraping 5X Faster With Job Sequencer & Request Blocker,https://www.mozenda.com/data-scraping-5x-faster/,9 окт. 2017 г.
Web Scraping Services Company India | Eminenture,https://www.eminenture.com/web-scraping-services.php,24 дек. 2021 г.
Screen Scraping Any Desktop Application - UiPath,https://www.uipath.com/learning/video-tutorials/screen-scraping-desktop-application,19 дек. 2014 г.
"Demonstration of ""scraping"" data from a web page with dev tools",https://www.youtube.com/watch?v=NsJ_xAOaPus,17 янв. 2018 г.
How to scrape website data to Notion - Bardeen,https://www.bardeen.ai/posts/scrape-data-to-notion,21 июн. 2021 г.
screen-scraper Introduction -- Data Extraction & Page Scraping,https://www.youtube.com/watch?v=s0erYF8MsyM,29 июл. 2008 г.
Web Scraping vs Web Crawling: The Differences | Oxylabs,https://oxylabs.io/blog/crawling-vs-scraping,10 окт. 2019 г.
Добыча данных с сайтов (web scraping) - Тяпк,https://tyapk.ru/blog/post/mining-data-from-websites,10 мая 2018 г.
Web Scraping vs Data Mining: What's the Difference?,https://www.parsehub.com/blog/web-scraping-vs-data-mining/,2 мар. 2020 г.
Web Scraping: Let Web Data Feed Your Website - WP All Import,https://www.wpallimport.com/web-scraping/,28 дек. 2021 г.
The Best Web Scraping Tools for 2021 | ScrapingBee,https://www.scrapingbee.com/blog/web-scraping-tools/,11 июн. 2021 г.
Web Scraping vs API: What's the Difference? | ParseHub,https://www.parsehub.com/blog/web-scraping-vs-api/,9 мар. 2020 г.
"Data Scraping Services, Web Scraper in India - IndiaMART ...",https://dir.indiamart.com/impcat/data-scraping-services.html,5 апр. 2014 г.
PDF Scraper Software For Data Providers & Agencies,https://docparser.com/industries/pdf-scraper-data-providers/,26 авг. 2017 г.
Web Scraping Techniques: How to Scrape Data from the Internet,https://www.parsehub.com/blog/web-scraping-techniques/,16 мар. 2020 г.
Scraping Data from Website to Excel (Tutorial 2022) | Octoparse,https://www.octoparse.com/blog/scraping-data-from-website-to-excel,1 месяц назад
"Data scraping, web scraping, data extraction and data mining",https://www.upwork.com/services/product/web-scraping-and-data-mining-1330753405936447488,2 дня назад
Web Scraping For Physician Review - OptiSol Business ...,https://www.optisolbusiness.com/insight/web-scraping-for-physician-review,7 мая 2021 г.
10 Best Open Source Web Scraper in 2022 | Octoparse,https://www.octoparse.com/blog/10-best-open-source-web-scraper,16 янв. 2022 г.
FAQ|15 Most Frequently Asked Questions about Web Scraping,https://www.octoparse.com/blog/15-most-frequently-asked-questions-of-web-scraping,9 мар. 2022 г.
How to scrape a website without code - Ultimate Guide,https://www.bardeen.ai/posts/how-to-scrape-a-website-without-code,11 авг. 2021 г.
How to use Bardeen scraper,https://www.bardeen.ai/tutorials/scraper,17 февр. 2022 г.
No Cost Data Scraping With GitHub Actions And Neo4j Aura,https://neo4j.com/videos/no-cost-data-scraping-with-github-actions-and-neo4j-aura/,15 июл. 2021 г.
Top 5 Web Scraping Tools to Use in Sourcing - WizardSourcer,https://wizardsourcer.com/top-5-web-scraping-tools-to-use-in-sourcing/,6 нояб. 2018 г.
Chrome 网上应用店 - Instant Data Scraper,https://chrome.google.com/webstore/detail/instant-data-scraper/ofaokhiedipichpaobibbnahnkdoiiah/reviews?hl=zh-CN,11 дек. 2019 г.
Is Web Scraping Easy? How to Scrape Data without Coding ...,https://www.parsehub.com/blog/web-scraping-easy/,10 февр. 2020 г.
WHAT IS DATA SCRAPING AND HOW CAN YOU USE IT?,https://www.linkedin.com/pulse/what-data-scraping-how-can-you-use-daniel-rowles,21 нояб. 2017 г.
Data Scraping with Python 3 - MIT Sloan Sports Analytics ...,https://www.sloansportsconference.com/event/data-scraping-with-python-3,2 мар. 2019 г.
Web Scraping Tool & Free Web Crawlers | Octoparse,https://www.octoparse.com/WebScraping,9 сент. 2021 г.
"Data via data scraping, web scraping with python code | Upwork",https://www.upwork.com/services/product/data-via-data-mining-data-scraping-web-scraping-in-your-desired-format-1429335660257034240,25 янв. 2022 г.
Perform Web Scraping On Wikipedia- Data Science - YouTube,https://www.youtube.com/watch?v=NeAhhBRHy4E,5 дек. 2019 г.
Data Scraper - Easy Web Scraping - Chrome Web Store,https://chrome.google.com/webstore/detail/data-scraper-easy-web-scr/nndknepjnldbdbepjfgmncbggmopgden?hl=es-419Es,24 сент. 2021 г.
5 Top Tips for Data Scraping Using Selenium in Python,https://towardsdatascience.com/5-top-tips-for-data-scraping-using-selenium-d8b83804681c,9 авг. 2020 г.
How to Scrape Data with a Simple and Easy-to-Use Scraper,https://www.parsehub.com/blog/simple-easy-web-scraper/,31 авг. 2020 г.
Web Scraping for SQL Machine learning using R scripts,https://www.sqlshack.com/web-scraping-for-sql-machine-learning-using-r-scripts/,14 дек. 2020 г.
Data Analytics with Python by Web scraping: Illustration with ...,https://towardsdatascience.com/data-analytics-with-python-by-web-scraping-illustration-with-cia-world-factbook-abbdaa687a84,3 мар. 2018 г.
How to Scrape Business Information including Emails - YouTube,https://www.youtube.com/watch?v=uSxM2MXO0HI,2 часа назад
Web scraping – everything you need to know | Smartproxy,https://smartproxy.com/what-is-web-scraping,7 дек. 2021 г.
"Clubhouse 1,3 mln danych data scraping - Just Geek IT",https://geek.justjoin.it/wyciek-data-scraping-dane-1-3-mln-uzytkownikow-clubhouse,12 апр. 2021 г.
OCR screen scraping - UI Vision,https://ui.vision/rpa/x/desktop-automation/screen-scraping,12 мая 2019 г.
"Web Data Scraping Using Webharvy - Library, University of ...",https://lib.cmb.ac.lk/web-data-scraping-using-webharvy/,29 янв. 2021 г.
Web Scraping Software to Extract Data from Websites | Agenty,https://agenty.com/products/scraping-agent/,29 авг. 2019 г.
Data Scraping Crawler tutorial | Phantombuster,https://phantombuster.com/automations/toolbox/22972/data-scraping-crawler/tutorial,25 авг. 2021 г.
Data Scraping From Any Website - IndiaMART,https://www.indiamart.com/proddetail/data-scraping-from-any-website-23791084073.html,25 июл. 2021 г.
An AI powered web scraper,https://chrome.google.com/webstore/detail/scraperai-an-ai-powered-w/acffgfiikphcopeiadpdmlpageboncak,20 янв. 2021 г.
Web Scraping Services Provider| By 3i Data ... - Facebook,https://m.facebook.com/3idatascrapingservices/videos/-3i-data-scraping-offers-the-exclusive-solution-to-scrape-data-from-airbnb-mobil/4679916335411155/,31 янв. 2022 г.
Reliably and efficiently pull data from pages that don't expect it,https://www.youtube.com/watch?v=52wxGESwQSA,9 мар. 2012 г.
Web Scraping Tool | Free Browser Extensions | Grepsr,https://www.grepsr.com/browser-extensions/,9 июн. 2016 г.
"CSS Selectors Hands-On (Nested Tags, ID Tags, Class Tags)",https://www.oreilly.com/library/view/data-scraping-and/9781801818483/video4_12.html,30 сент. 2021 г.
"How to Scrape Amazon Product Data: Names, Pricing, ASIN, etc.",https://www.parsehub.com/blog/scrape-amazon-product-data/,9 нояб. 2020 г.
Instant Data Scraper - Microsoft Edge Addons,https://microsoftedge.microsoft.com/addons/detail/instant-data-scraper/onnjkaofddpgfmbcnbnfacjacjamelfa,11 дек. 2019 г.
Missing Screen Scraping and Data Scraping in UiPath,https://www.youtube.com/watch?v=Awu9DnSGzpA,14 нояб. 2021 г.
Byteline Web Scraper,https://www.byteline.io/web-scraper,31 мар. 2021 г.
Getting Started with Scrapy - Data Scraping and Data Mining ...,https://www.oreilly.com/library/view/data-scraping-and/9781801818483/video5_4.html,30 сент. 2021 г.
10 Questions to Ask Before Proceeding with Web Scraping,https://www.octoparse.com/blog/10-questions-to-ask-before-proceeding-with-web-scraping,6 янв. 2020 г.
Scraping Movie Names from IMDB - O'Reilly Media,https://www.oreilly.com/library/view/data-scraping-and/9781801818483/video3_11.html,30 сент. 2021 г.
Chrome 网上应用店 - Instant Data Scraper,https://chrome.google.com/webstore/detail/instant-data-scraper/ofaokhiedipichpaobibbnahnkdoiiah/support?hl=zh-CN,4 дня назад
Data Scraping and Visualizing using Instant Data Scraper ...,https://osintcurio.us/2020/04/15/data-scraping-and-visualizing-using-instant-data-scraper-viewdns-info-and-maltego/,15 апр. 2020 г.
How does web scraping work? | ParseHub,https://www.parsehub.com/blog/how-web-scraping-works/,24 февр. 2020 г.
